created,domain,id,num_comments,question_id,quiz_id,score,subreddit,title,url,image_pair_id,quiz_cluster
1401247725.0,imgur.com,26o02n,227,0,08e01c25-8ab2-4127-8983-5fbd477029c5,2426,funny,My girlfriend told me that the vacuum didn't work. I couldn't imagine why.,http://i.imgur.com/yzzv5yC.jpg,0,e1cedf87-32ba-40c3-80ca-c92072639df2
1401241665.0,i.imgur.com,26nr1j,888,0,08e01c25-8ab2-4127-8983-5fbd477029c5,2380,funny,I officially have lost all hope in my hospital's computer system...,http://i.imgur.com/kSfMx1b.jpg,1,e1cedf87-32ba-40c3-80ca-c92072639df2
1401906975.0,i.imgur.com,27b99q,829,1,08e01c25-8ab2-4127-8983-5fbd477029c5,1710,funny,After seeing all these kids celebrating their HS graduation on Facebook....,http://i.imgur.com/pHLz4jL.jpg,0,e1cedf87-32ba-40c3-80ca-c92072639df2
1401898377.0,imgur.com,27aue3,90,1,08e01c25-8ab2-4127-8983-5fbd477029c5,3166,funny,"Unlike some, I've been cool since day 1",http://i.imgur.com/4R6TbMG.jpg,1,e1cedf87-32ba-40c3-80ca-c92072639df2
1401908947.0,i.imgur.com,27bcvb,84,2,08e01c25-8ab2-4127-8983-5fbd477029c5,2974,funny,Security Level? Maximum.,http://i.imgur.com/9W2wEsf.jpg,0,e1cedf87-32ba-40c3-80ca-c92072639df2
1401902446.0,i.imgur.com,27b1e9,285,2,08e01c25-8ab2-4127-8983-5fbd477029c5,2967,funny,Lunch time at work really showcases the difference between single and married life.,http://i.imgur.com/VeN3BiO.jpg,1,e1cedf87-32ba-40c3-80ca-c92072639df2
1401617176.0,imgur.com,270rq4,523,3,08e01c25-8ab2-4127-8983-5fbd477029c5,2818,funny,I have no idea what happens after this screen. I've never waited long enough...,http://i.imgur.com/wk7Qvvj.png,0,e1cedf87-32ba-40c3-80ca-c92072639df2
1401618761.0,i.imgur.com,270sqz,163,3,08e01c25-8ab2-4127-8983-5fbd477029c5,2299,funny,Happy birthday to the great man!,http://i.imgur.com/q5PU1RJ.jpg,1,e1cedf87-32ba-40c3-80ca-c92072639df2
1401749036.0,i.imgur.com,275hg8,335,4,08e01c25-8ab2-4127-8983-5fbd477029c5,2962,funny,Living in AZ summed up,http://i.imgur.com/9CdlcL8.jpg,0,e1cedf87-32ba-40c3-80ca-c92072639df2
1401744933.0,i.imgur.com,275arz,910,4,08e01c25-8ab2-4127-8983-5fbd477029c5,3344,funny,Not exactly loaded,http://i.imgur.com/NVUM5hX.jpg,1,e1cedf87-32ba-40c3-80ca-c92072639df2
1401497105.0,imgur.com,26x6x6,267,5,08e01c25-8ab2-4127-8983-5fbd477029c5,1433,funny,Unemployment. The struggle is real.,http://i.imgur.com/JOpZeZx.jpg,0,e1cedf87-32ba-40c3-80ca-c92072639df2
1401487960.0,i.imgur.com,26wtwh,114,5,08e01c25-8ab2-4127-8983-5fbd477029c5,3572,funny,Ugh.... Do I have tooooo?,http://i.imgur.com/NwgXaWi.jpg,1,e1cedf87-32ba-40c3-80ca-c92072639df2
1401380253.0,i.imgur.com,26sopg,673,6,08e01c25-8ab2-4127-8983-5fbd477029c5,3884,funny,We had a photo booth at our wedding. I think my brother in law doesn't understand how photobooths work.,http://i.imgur.com/cvEl7cg.jpg,0,e1cedf87-32ba-40c3-80ca-c92072639df2
1401375066.0,i.imgur.com,26sg4x,2352,6,08e01c25-8ab2-4127-8983-5fbd477029c5,4815,funny,University grads telling it like it is,http://i.imgur.com/KBvPngO.jpg,1,e1cedf87-32ba-40c3-80ca-c92072639df2
1401145906.0,i.imgur.com,26k5kk,200,7,08e01c25-8ab2-4127-8983-5fbd477029c5,1876,funny,My buddy and I added this sticker to his brother's Saturn Vibe. No he is not a raiders fan. (Wait for it),http://i.imgur.com/WfcOK5Q.jpg,0,e1cedf87-32ba-40c3-80ca-c92072639df2
1401134713.0,imgur.com,26job9,406,7,08e01c25-8ab2-4127-8983-5fbd477029c5,2691,funny,I like this girls style,http://i.imgur.com/7qhskGV.jpg,1,e1cedf87-32ba-40c3-80ca-c92072639df2
1401774802.0,i.imgur.com,276i70,564,8,08e01c25-8ab2-4127-8983-5fbd477029c5,2934,funny,She knows what I mean.,http://i.imgur.com/tCU7J4J.jpg,0,e1cedf87-32ba-40c3-80ca-c92072639df2
1401774802.0,i.imgur.com,276i70,564,8,08e01c25-8ab2-4127-8983-5fbd477029c5,2934,funny,She knows what I mean.,http://i.imgur.com/tCU7J4J.jpg,1,e1cedf87-32ba-40c3-80ca-c92072639df2
1401488576.0,i.imgur.com,26wuuo,1098,9,08e01c25-8ab2-4127-8983-5fbd477029c5,2925,funny,Do you ever worry about your species?,http://i.imgur.com/Jlsx7wW.jpg,0,e1cedf87-32ba-40c3-80ca-c92072639df2
1401301319.0,i.imgur.com,26prxt,308,10,08e01c25-8ab2-4127-8983-5fbd477029c5,3412,funny,bear looks sarcastic as fuck,http://i.imgur.com/2flQ2A2.jpg,0,e1cedf87-32ba-40c3-80ca-c92072639df2
1401316399.0,i.imgur.com,26qiyt,30,10,08e01c25-8ab2-4127-8983-5fbd477029c5,2673,funny,Just saw this sign at the dentist office,http://i.imgur.com/nna0TNU.jpg,1,e1cedf87-32ba-40c3-80ca-c92072639df2
1401166913.0,i.imgur.com,26kyjv,489,11,08e01c25-8ab2-4127-8983-5fbd477029c5,2859,funny,every tux for prom had a note from an elementary schooler in it.....,http://i.imgur.com/OLMQAHv.jpg,0,e1cedf87-32ba-40c3-80ca-c92072639df2
1401168247.0,i.imgur.com,26l03c,53,11,08e01c25-8ab2-4127-8983-5fbd477029c5,2619,funny,"It's wrong to take pictures of people eating on trains, but look at this...",http://i.imgur.com/92aMyyI.jpg,1,e1cedf87-32ba-40c3-80ca-c92072639df2
1401210718.0,i.imgur.com,26mbp7,414,12,08e01c25-8ab2-4127-8983-5fbd477029c5,3122,funny,A great analogy for computer viruses,http://i.imgur.com/9aoeSW2.jpg,0,e1cedf87-32ba-40c3-80ca-c92072639df2
1401208127.0,imgur.com,26m7al,250,12,08e01c25-8ab2-4127-8983-5fbd477029c5,3425,funny,Just noticed Michael Scott's diploma on the wall,http://i.imgur.com/YmWARhC.png,1,e1cedf87-32ba-40c3-80ca-c92072639df2
1401632862.0,imgur.com,2714jp,749,13,08e01c25-8ab2-4127-8983-5fbd477029c5,3645,funny,"Nothing worse than waking up on a Sunday morning, and having to clean up the carnage left behind after another wild Saturday night.",http://i.imgur.com/2ttVNms.jpg,0,e1cedf87-32ba-40c3-80ca-c92072639df2
1401632862.0,imgur.com,2714jp,749,13,08e01c25-8ab2-4127-8983-5fbd477029c5,3645,funny,"Nothing worse than waking up on a Sunday morning, and having to clean up the carnage left behind after another wild Saturday night.",http://i.imgur.com/2ttVNms.jpg,1,e1cedf87-32ba-40c3-80ca-c92072639df2
1401434047.0,i.imgur.com,26uw2c,48,14,08e01c25-8ab2-4127-8983-5fbd477029c5,2109,funny,Guess who showed up at my nieces birthday party?,http://i.imgur.com/qpTZC8V.jpg,1,e1cedf87-32ba-40c3-80ca-c92072639df2
1401689027.0,i.imgur.com,273akt,829,15,08e01c25-8ab2-4127-8983-5fbd477029c5,3297,funny,Man this series makes no fucking sense,http://i.imgur.com/kMoI9Vn.jpg,0,e1cedf87-32ba-40c3-80ca-c92072639df2
1401689027.0,i.imgur.com,273akt,829,15,08e01c25-8ab2-4127-8983-5fbd477029c5,3297,funny,Man this series makes no fucking sense,http://i.imgur.com/kMoI9Vn.jpg,1,e1cedf87-32ba-40c3-80ca-c92072639df2
1401466467.0,i.imgur.com,26vus2,325,16,08e01c25-8ab2-4127-8983-5fbd477029c5,2710,funny,Found gold in Reader's Digest,http://i.imgur.com/fF8ieTM.jpg,0,e1cedf87-32ba-40c3-80ca-c92072639df2
1401466035.0,imgur.com,26vu3t,48,16,08e01c25-8ab2-4127-8983-5fbd477029c5,2853,funny,Adult Toys,http://i.imgur.com/lafTUmE.png,1,e1cedf87-32ba-40c3-80ca-c92072639df2
1401888469.0,i.imgur.com,27afcb,130,17,08e01c25-8ab2-4127-8983-5fbd477029c5,2416,funny,Sounds like a good song.,http://i.imgur.com/cBg3dr7.jpg,0,e1cedf87-32ba-40c3-80ca-c92072639df2
1401884200.0,imgur.com,27aabz,561,17,08e01c25-8ab2-4127-8983-5fbd477029c5,3220,funny,How things change,http://i.imgur.com/NWfe52K.png,1,e1cedf87-32ba-40c3-80ca-c92072639df2
1401299359.0,i.imgur.com,26pok0,407,18,08e01c25-8ab2-4127-8983-5fbd477029c5,3517,funny,You can't just ask someone who's the fork,http://i.imgur.com/tILWA1z.jpg,0,e1cedf87-32ba-40c3-80ca-c92072639df2
1401300119.0,i.imgur.com,26ppv6,67,18,08e01c25-8ab2-4127-8983-5fbd477029c5,3167,funny,I'll just leave my cow here.,http://i.imgur.com/qXpC8.jpg,1,e1cedf87-32ba-40c3-80ca-c92072639df2
1401729076.0,i.imgur.com,274iw4,295,19,08e01c25-8ab2-4127-8983-5fbd477029c5,2898,funny,"First my wife said the walls were too bare, and now they are too bear.",http://i.imgur.com/LePWV80.jpg,1,e1cedf87-32ba-40c3-80ca-c92072639df2
1401757482.0,i.imgur.com,275up3,191,20,08e01c25-8ab2-4127-8983-5fbd477029c5,3111,funny,"An elderly woman brought a stray ""cat"" into our shelter today...",http://i.imgur.com/XYC0qcW.jpg,0,e1cedf87-32ba-40c3-80ca-c92072639df2
1401753584.0,i.imgur.com,275ops,221,20,08e01c25-8ab2-4127-8983-5fbd477029c5,2986,funny,Mrs. Frizzle took the kids to the south side,http://i.imgur.com/vuSzexL.jpg,1,e1cedf87-32ba-40c3-80ca-c92072639df2
1401635361.0,i.imgur.com,2717le,312,21,08e01c25-8ab2-4127-8983-5fbd477029c5,3498,funny,We saved a turtle crossing the street. The turtle decided to thank us in a odd way.,http://i.imgur.com/VDOLVFd.jpg,0,e1cedf87-32ba-40c3-80ca-c92072639df2
1401646700.0,i.imgur.com,271ng3,58,21,08e01c25-8ab2-4127-8983-5fbd477029c5,2447,funny,Mario and lugi make it to a shore,http://i.imgur.com/dU5Mecd.jpg,1,e1cedf87-32ba-40c3-80ca-c92072639df2
1401924774.0,i.imgur.com,27c44e,274,22,08e01c25-8ab2-4127-8983-5fbd477029c5,2872,funny,"My Dad just sent me this with the caption ""Minotaur. """,http://i.imgur.com/WHlDgdh.jpg,0,e1cedf87-32ba-40c3-80ca-c92072639df2
1401924774.0,i.imgur.com,27c44e,274,22,08e01c25-8ab2-4127-8983-5fbd477029c5,2872,funny,"My Dad just sent me this with the caption ""Minotaur. """,http://i.imgur.com/WHlDgdh.jpg,1,e1cedf87-32ba-40c3-80ca-c92072639df2
1401139296.0,i.imgur.com,26jvmw,66,23,08e01c25-8ab2-4127-8983-5fbd477029c5,2910,funny,Bladrblrrrblrbbbrllr,http://i.imgur.com/SLkWcvx.jpg,0,e1cedf87-32ba-40c3-80ca-c92072639df2
1401138480.0,i.imgur.com,26jucp,473,23,08e01c25-8ab2-4127-8983-5fbd477029c5,2691,funny,"If you're ever feeling down, just think about that time a bird flew into Fabio's face on a roller coaster.",http://i.imgur.com/td5L4yK.jpg,1,e1cedf87-32ba-40c3-80ca-c92072639df2
1401643100.0,i.imgur.com,271i9f,238,24,08e01c25-8ab2-4127-8983-5fbd477029c5,2958,funny,Clinging ivy? Ain't no thing...,http://i.imgur.com/6nkGfvk.jpg,0,e1cedf87-32ba-40c3-80ca-c92072639df2
1401645397.0,imgur.com,271ljy,323,24,08e01c25-8ab2-4127-8983-5fbd477029c5,3103,funny,My Wife Sent This to Me and Asked If I Had Ever Seen Requiem For A Dream,http://i.imgur.com/J03Fv7I.jpg,1,e1cedf87-32ba-40c3-80ca-c92072639df2
1401186049.0,i.imgur.com,26lfae,182,25,08e01c25-8ab2-4127-8983-5fbd477029c5,2471,funny,I would like to see Canada,http://i.imgur.com/ZmYbVIY.jpg,1,e1cedf87-32ba-40c3-80ca-c92072639df2
1401323939.0,i.imgur.com,26quho,387,26,08e01c25-8ab2-4127-8983-5fbd477029c5,3766,funny,This is the best headline I have ever seen.,http://i.imgur.com/MIaPmSU.jpg,0,e1cedf87-32ba-40c3-80ca-c92072639df2
1401331784.0,imgur.com,26r6ka,123,26,08e01c25-8ab2-4127-8983-5fbd477029c5,1646,funny,r/funny in a nutshell,http://i.imgur.com/TJHTSmu.jpg,1,e1cedf87-32ba-40c3-80ca-c92072639df2
1401962940.0,i.imgur.com,27ddbb,3010,27,08e01c25-8ab2-4127-8983-5fbd477029c5,3598,funny,So this was just posted in my building's notice board...,http://i.imgur.com/Rjhh02X.jpg,0,e1cedf87-32ba-40c3-80ca-c92072639df2
1401962940.0,i.imgur.com,27ddbb,3010,27,08e01c25-8ab2-4127-8983-5fbd477029c5,3598,funny,So this was just posted in my building's notice board...,http://i.imgur.com/Rjhh02X.jpg,1,e1cedf87-32ba-40c3-80ca-c92072639df2
1401453625.0,imgur.com,26vbz8,68,28,08e01c25-8ab2-4127-8983-5fbd477029c5,2649,funny,"…for a limited time, only at Shoprite!",http://i.imgur.com/wm6jGx3.jpg,0,e1cedf87-32ba-40c3-80ca-c92072639df2
1401448389.0,i.imgur.com,26v6ws,101,28,08e01c25-8ab2-4127-8983-5fbd477029c5,2325,funny,Can't stop laughing at this,http://i.imgur.com/d97ySR2.jpg,1,e1cedf87-32ba-40c3-80ca-c92072639df2
1401558000.0,i.imgur.com,26yx38,252,29,08e01c25-8ab2-4127-8983-5fbd477029c5,2906,funny,"""Excuse sir..what the fuck do you think you are doing?""",http://i.imgur.com/cPSV1yy.jpg,0,e1cedf87-32ba-40c3-80ca-c92072639df2
1401560965.0,i.imgur.com,26z17x,138,29,08e01c25-8ab2-4127-8983-5fbd477029c5,3004,funny,Joseph Gordon-Levitt in the Third Rock From The Sun pilot.,http://i.imgur.com/rZYy1gg.jpg,1,e1cedf87-32ba-40c3-80ca-c92072639df2
1401666961.0,imgur.com,272h94,74,30,08e01c25-8ab2-4127-8983-5fbd477029c5,2173,funny,Driving behind a bus..,http://i.imgur.com/SbLuOZL.jpg,0,e1cedf87-32ba-40c3-80ca-c92072639df2
1401662808.0,i.imgur.com,272bdp,165,30,08e01c25-8ab2-4127-8983-5fbd477029c5,2262,funny,Graduation card from my dad,http://i.imgur.com/DWCqvvx.jpg,1,e1cedf87-32ba-40c3-80ca-c92072639df2
1401105593.0,i.imgur.com,26ikkh,79,31,08e01c25-8ab2-4127-8983-5fbd477029c5,2705,funny,"Well, this is peculiar.",http://i.imgur.com/VGaClTe.jpg,0,e1cedf87-32ba-40c3-80ca-c92072639df2
1401106583.0,imgur.com,26ilgm,77,31,08e01c25-8ab2-4127-8983-5fbd477029c5,2561,funny,Get back to work.,http://i.imgur.com/r6LGsSI.jpg,1,e1cedf87-32ba-40c3-80ca-c92072639df2
1401729029.0,i.imgur.com,274isy,544,32,08e01c25-8ab2-4127-8983-5fbd477029c5,2585,funny,"I turned 25 over the weekend. So as a present, my best buddies and I took this picture",http://i.imgur.com/NNRxUCW.jpg,0,e1cedf87-32ba-40c3-80ca-c92072639df2
1401729029.0,i.imgur.com,274isy,544,32,08e01c25-8ab2-4127-8983-5fbd477029c5,2585,funny,"I turned 25 over the weekend. So as a present, my best buddies and I took this picture",http://i.imgur.com/NNRxUCW.jpg,1,e1cedf87-32ba-40c3-80ca-c92072639df2
1401988116.0,i.imgur.com,27ea1n,812,33,08e01c25-8ab2-4127-8983-5fbd477029c5,3121,funny,"Was just in Five Guys and a couple of people wanted to take a picture with my dad because they thought he was Danny DeVito from Always Sunny. Frankly, I don't see it...",http://i.imgur.com/w5TJBFG.jpg,0,e1cedf87-32ba-40c3-80ca-c92072639df2
1401988839.0,i.imgur.com,27ebbi,226,33,08e01c25-8ab2-4127-8983-5fbd477029c5,2794,funny,Wildfire burn!!,http://i.imgur.com/5jGBlBG.jpg,1,e1cedf87-32ba-40c3-80ca-c92072639df2
1402006963.0,i.imgur.com,27f6r2,38,34,08e01c25-8ab2-4127-8983-5fbd477029c5,2805,funny,Went through my school yearbook and found this...,http://i.imgur.com/bvcnGE6.jpg,0,e1cedf87-32ba-40c3-80ca-c92072639df2
1402006963.0,i.imgur.com,27f6r2,38,34,08e01c25-8ab2-4127-8983-5fbd477029c5,2805,funny,Went through my school yearbook and found this...,http://i.imgur.com/bvcnGE6.jpg,1,e1cedf87-32ba-40c3-80ca-c92072639df2
1401813884.0,i.imgur.com,277pne,371,35,08e01c25-8ab2-4127-8983-5fbd477029c5,3208,funny,Selfie multitasking at work,http://i.imgur.com/VF2QouF.jpg,0,e1cedf87-32ba-40c3-80ca-c92072639df2
1401814172.0,i.imgur.com,277q55,161,35,08e01c25-8ab2-4127-8983-5fbd477029c5,3200,funny,"Don't bring that weak shit here, Sister Mary.",http://i.imgur.com/pAw7jsz.jpg,1,e1cedf87-32ba-40c3-80ca-c92072639df2
1401325939.0,i.imgur.com,26qxjm,233,36,08e01c25-8ab2-4127-8983-5fbd477029c5,3815,funny,My Dad went to a Bruce Springsteen concert the other day. This is the only picture he took.,http://i.imgur.com/n4vUVWx.jpg,0,e1cedf87-32ba-40c3-80ca-c92072639df2
1401327897.0,i.imgur.com,26r0ks,130,36,08e01c25-8ab2-4127-8983-5fbd477029c5,3340,funny,Someone paid with this at the store I work at today,http://i.imgur.com/vZQxyp4.jpg,1,e1cedf87-32ba-40c3-80ca-c92072639df2
1401983662.0,i.imgur.com,27e2fy,168,37,08e01c25-8ab2-4127-8983-5fbd477029c5,2353,funny,Always!,http://i.imgur.com/HBJZx8r.jpg,0,e1cedf87-32ba-40c3-80ca-c92072639df2
1401051027.0,i.imgur.com,26gxla,139,38,08e01c25-8ab2-4127-8983-5fbd477029c5,2761,funny,Not the greatest tool for a drunk...,http://i.imgur.com/SUoQAAt.jpg,0,e1cedf87-32ba-40c3-80ca-c92072639df2
1401047727.0,imgur.com,26gt0y,178,38,08e01c25-8ab2-4127-8983-5fbd477029c5,3038,funny,Goodbye World..,http://i.imgur.com/yrwPdY2.jpg,1,e1cedf87-32ba-40c3-80ca-c92072639df2
1401465858.0,i.imgur.com,26vtt5,486,39,08e01c25-8ab2-4127-8983-5fbd477029c5,3096,funny,Welcome to Portland,http://i.imgur.com/l0UFnUp.jpg,0,e1cedf87-32ba-40c3-80ca-c92072639df2
1401463923.0,i.imgur.com,26vqil,202,39,08e01c25-8ab2-4127-8983-5fbd477029c5,3261,funny,Someone has to lose some weight...,http://i.imgur.com/dHnCjJb.jpg,1,e1cedf87-32ba-40c3-80ca-c92072639df2
1401139818.0,i.imgur.com,26jwga,171,40,08e01c25-8ab2-4127-8983-5fbd477029c5,1634,funny,"Oh, Toto.",http://i.imgur.com/eAXFPbf.jpg,0,e1cedf87-32ba-40c3-80ca-c92072639df2
1401130749.0,i.imgur.com,26jhxr,126,40,08e01c25-8ab2-4127-8983-5fbd477029c5,2468,funny,The girliest of girly things.,http://i.imgur.com/ykgDkEQ.jpg,1,e1cedf87-32ba-40c3-80ca-c92072639df2
1401394552.0,i.imgur.com,26td20,211,41,08e01c25-8ab2-4127-8983-5fbd477029c5,3480,funny,Ian Malcolm's giant pizza theory,http://i.imgur.com/BXbQyP3.jpg,0,e1cedf87-32ba-40c3-80ca-c92072639df2
1401394639.0,i.imgur.com,26td7h,122,41,08e01c25-8ab2-4127-8983-5fbd477029c5,2592,funny,Never noticed this guy in friends,http://i.imgur.com/iKTexbC.jpg,1,e1cedf87-32ba-40c3-80ca-c92072639df2
1401875742.0,i.imgur.com,27a33s,37,44,08e01c25-8ab2-4127-8983-5fbd477029c5,2996,funny,His face says it all.,http://i.imgur.com/cb4WOPC.jpg,0,e1cedf87-32ba-40c3-80ca-c92072639df2
1401878668.0,imgur.com,27a5dg,48,44,08e01c25-8ab2-4127-8983-5fbd477029c5,2144,funny,But...,http://i.imgur.com/o9J7CdY.jpg,1,e1cedf87-32ba-40c3-80ca-c92072639df2
1401493815.0,i.imgur.com,26x2gz,66,45,08e01c25-8ab2-4127-8983-5fbd477029c5,3092,funny,What happens when you don't want a senior quote,http://i.imgur.com/ZSNrQEj.png,0,e1cedf87-32ba-40c3-80ca-c92072639df2
1401493815.0,i.imgur.com,26x2gz,66,45,08e01c25-8ab2-4127-8983-5fbd477029c5,3092,funny,What happens when you don't want a senior quote,http://i.imgur.com/ZSNrQEj.png,1,e1cedf87-32ba-40c3-80ca-c92072639df2
1401790574.0,i.imgur.com,276v0s,572,46,08e01c25-8ab2-4127-8983-5fbd477029c5,2774,funny,How my friend showed they are having another child,http://i.imgur.com/1KX0pHl.jpg,0,e1cedf87-32ba-40c3-80ca-c92072639df2
1401790574.0,i.imgur.com,276v0s,572,46,08e01c25-8ab2-4127-8983-5fbd477029c5,2774,funny,How my friend showed they are having another child,http://i.imgur.com/1KX0pHl.jpg,1,e1cedf87-32ba-40c3-80ca-c92072639df2
1401150701.0,i.imgur.com,26kci1,626,47,08e01c25-8ab2-4127-8983-5fbd477029c5,2733,funny,My wife told me to send her a naughty picture whilst I was out of town...,http://i.imgur.com/w4iiiR8.jpg,0,e1cedf87-32ba-40c3-80ca-c92072639df2
1401149416.0,i.imgur.com,26kanb,64,47,08e01c25-8ab2-4127-8983-5fbd477029c5,2401,funny,Is he still at the door?,http://i.imgur.com/ynBHgxE.jpg,1,e1cedf87-32ba-40c3-80ca-c92072639df2
1401139595.0,i.imgur.com,26jw3d,819,48,08e01c25-8ab2-4127-8983-5fbd477029c5,3518,funny,Ruins of an ancient civilization.,http://i.imgur.com/HWq9N3p.jpg,0,e1cedf87-32ba-40c3-80ca-c92072639df2
1401139595.0,i.imgur.com,26jw3d,819,48,08e01c25-8ab2-4127-8983-5fbd477029c5,3518,funny,Ruins of an ancient civilization.,http://i.imgur.com/HWq9N3p.jpg,1,e1cedf87-32ba-40c3-80ca-c92072639df2
1401764287.0,i.imgur.com,2764xq,191,49,08e01c25-8ab2-4127-8983-5fbd477029c5,2315,funny,Forrest and relationships,http://i.imgur.com/79H5e1v.jpg,0,e1cedf87-32ba-40c3-80ca-c92072639df2
1401764287.0,i.imgur.com,2764xq,191,49,08e01c25-8ab2-4127-8983-5fbd477029c5,2315,funny,Forrest and relationships,http://i.imgur.com/79H5e1v.jpg,1,e1cedf87-32ba-40c3-80ca-c92072639df2
1401224437.0,i.imgur.com,26mzhx,190,50,08e01c25-8ab2-4127-8983-5fbd477029c5,3105,funny,The three little pigs,http://i.imgur.com/ca5Na9A.jpg,0,e1cedf87-32ba-40c3-80ca-c92072639df2
1401221560.0,i.imgur.com,26mugw,335,50,08e01c25-8ab2-4127-8983-5fbd477029c5,3987,funny,Birdpoop masterpiece at the parking lot,http://i.imgur.com/QCX0hHd.jpg,1,e1cedf87-32ba-40c3-80ca-c92072639df2
1401659472.0,imgur.com,2726dl,93,51,08e01c25-8ab2-4127-8983-5fbd477029c5,1103,funny,Justice System,http://i.imgur.com/avh6rDC.jpg,0,e1cedf87-32ba-40c3-80ca-c92072639df2
1401641241.0,i.imgur.com,271fiv,31,51,08e01c25-8ab2-4127-8983-5fbd477029c5,1643,funny,It all makes sense.,http://i.imgur.com/lIxaXbn.jpg,1,e1cedf87-32ba-40c3-80ca-c92072639df2
1401150701.0,i.imgur.com,26kci1,626,52,08e01c25-8ab2-4127-8983-5fbd477029c5,2733,funny,My wife told me to send her a naughty picture whilst I was out of town...,http://i.imgur.com/w4iiiR8.jpg,0,e1cedf87-32ba-40c3-80ca-c92072639df2
1401149416.0,i.imgur.com,26kanb,64,52,08e01c25-8ab2-4127-8983-5fbd477029c5,2401,funny,Is he still at the door?,http://i.imgur.com/ynBHgxE.jpg,1,e1cedf87-32ba-40c3-80ca-c92072639df2
1401990183.0,i.imgur.com,27edmh,52,53,08e01c25-8ab2-4127-8983-5fbd477029c5,2327,funny,Loved this show,http://i.imgur.com/51bpqs9.png,0,e1cedf87-32ba-40c3-80ca-c92072639df2
1401982744.0,i.imgur.com,27e0w4,114,53,08e01c25-8ab2-4127-8983-5fbd477029c5,3036,funny,Mexican hair restoration clinic saves Blockbuster TV show,http://i.imgur.com/ZSh0t4I.jpg,1,e1cedf87-32ba-40c3-80ca-c92072639df2
1401235900.0,imgur.com,26ni57,314,54,08e01c25-8ab2-4127-8983-5fbd477029c5,1740,funny,You know you're in the Midwest U.S. when you order a Large Baja Blast from Taco Bell and they give you this.,http://i.imgur.com/xAj0awk.jpg,0,e1cedf87-32ba-40c3-80ca-c92072639df2
1401235177.0,i.imgur.com,26nh12,27,54,08e01c25-8ab2-4127-8983-5fbd477029c5,2090,funny,Funerals can be tricky,http://i.imgur.com/ai3uoq7.jpg,1,e1cedf87-32ba-40c3-80ca-c92072639df2
1402004552.0,imgur.com,27f2p2,27,55,08e01c25-8ab2-4127-8983-5fbd477029c5,1055,funny,"Why the previous tenant left these magnets in an apartment I cleaned, I will never know.",http://i.imgur.com/wFRA58l.jpg,0,e1cedf87-32ba-40c3-80ca-c92072639df2
1402004552.0,imgur.com,27f2p2,27,55,08e01c25-8ab2-4127-8983-5fbd477029c5,1055,funny,"Why the previous tenant left these magnets in an apartment I cleaned, I will never know.",http://i.imgur.com/wFRA58l.jpg,1,e1cedf87-32ba-40c3-80ca-c92072639df2
1401883863.0,i.imgur.com,27a9zo,13,56,08e01c25-8ab2-4127-8983-5fbd477029c5,585,funny,Do you seeeee?,http://i.imgur.com/nLEGTVP.jpg,0,e1cedf87-32ba-40c3-80ca-c92072639df2
1401844244.0,imgur.com,2794b7,408,56,08e01c25-8ab2-4127-8983-5fbd477029c5,3296,funny,Mum sent me this pic this morning. I think my coolness peaked at age 4.,http://i.imgur.com/68r8gjF.jpg,1,e1cedf87-32ba-40c3-80ca-c92072639df2
1401307467.0,i.imgur.com,26q32d,44,57,08e01c25-8ab2-4127-8983-5fbd477029c5,856,funny,Coworker lost his virginity. A few of us chipped in to get him this.,http://i.imgur.com/nRE1EXH.jpg,0,e1cedf87-32ba-40c3-80ca-c92072639df2
1401289332.0,imgur.com,26p7lr,157,57,08e01c25-8ab2-4127-8983-5fbd477029c5,2142,funny,It's not easy being green,http://i.imgur.com/0JfUsuI.jpg,1,e1cedf87-32ba-40c3-80ca-c92072639df2
1401243037.0,i.imgur.com,26nt7b,334,58,08e01c25-8ab2-4127-8983-5fbd477029c5,3049,funny,Most considerate inconsiderate neighbor? Came home to this and a bag of cookies on my door today.,http://i.imgur.com/JzYACwB.jpg,0,e1cedf87-32ba-40c3-80ca-c92072639df2
1401243037.0,i.imgur.com,26nt7b,334,58,08e01c25-8ab2-4127-8983-5fbd477029c5,3049,funny,Most considerate inconsiderate neighbor? Came home to this and a bag of cookies on my door today.,http://i.imgur.com/JzYACwB.jpg,1,e1cedf87-32ba-40c3-80ca-c92072639df2
1401560965.0,i.imgur.com,26z17x,138,59,08e01c25-8ab2-4127-8983-5fbd477029c5,3004,funny,Joseph Gordon-Levitt in the Third Rock From The Sun pilot.,http://i.imgur.com/rZYy1gg.jpg,0,e1cedf87-32ba-40c3-80ca-c92072639df2
1401560965.0,i.imgur.com,26z17x,138,59,08e01c25-8ab2-4127-8983-5fbd477029c5,3004,funny,Joseph Gordon-Levitt in the Third Rock From The Sun pilot.,http://i.imgur.com/rZYy1gg.jpg,1,e1cedf87-32ba-40c3-80ca-c92072639df2
1401213979.0,i.imgur.com,26mh7w,112,60,08e01c25-8ab2-4127-8983-5fbd477029c5,2624,funny,Every time I go to see Grandma,http://i.imgur.com/zdlVVU3.png,0,e1cedf87-32ba-40c3-80ca-c92072639df2
1401216155.0,imgur.com,26mkze,56,60,08e01c25-8ab2-4127-8983-5fbd477029c5,2288,funny,"Stopped at a red light, I turned to this BAMF",http://i.imgur.com/Xi2cQ07.jpg,1,e1cedf87-32ba-40c3-80ca-c92072639df2
1401924774.0,i.imgur.com,27c44e,274,61,08e01c25-8ab2-4127-8983-5fbd477029c5,2875,funny,"My Dad just sent me this with the caption ""Minotaur. """,http://i.imgur.com/WHlDgdh.jpg,0,e1cedf87-32ba-40c3-80ca-c92072639df2
1401718056.0,imgur.com,27413s,597,62,08e01c25-8ab2-4127-8983-5fbd477029c5,4411,funny,Some friends took a picture and later realized that the people in the background were stuffing a baby in a cannon.,http://i.imgur.com/MpcrHOB.jpg,0,e1cedf87-32ba-40c3-80ca-c92072639df2
1401720421.0,i.imgur.com,2744nn,146,62,08e01c25-8ab2-4127-8983-5fbd477029c5,3336,funny,I have absolutely no idea who shredded the cusion.,http://i.imgur.com/s06fUIf.jpg,1,e1cedf87-32ba-40c3-80ca-c92072639df2
1401714001.0,imgur.com,273vvr,23,63,08e01c25-8ab2-4127-8983-5fbd477029c5,1911,funny,I am squidward..,http://i.imgur.com/Mbi3PUv.jpg,0,e1cedf87-32ba-40c3-80ca-c92072639df2
1401718820.0,i.imgur.com,27427k,16,63,08e01c25-8ab2-4127-8983-5fbd477029c5,1600,funny,Heralded Hero,http://i.imgur.com/bATf0PX.jpg,1,e1cedf87-32ba-40c3-80ca-c92072639df2
1401543061.0,imgur.com,26ye6p,341,64,08e01c25-8ab2-4127-8983-5fbd477029c5,2655,funny,"We had an argument this morning, as a result she only made her side of the bed",http://i.imgur.com/5KHXw20.jpg,0,e1cedf87-32ba-40c3-80ca-c92072639df2
1401566629.0,i.imgur.com,26z98f,40,64,08e01c25-8ab2-4127-8983-5fbd477029c5,943,funny,Sign outside a local shop in Knoxville,http://i.imgur.com/UmyTYSV.jpg,1,e1cedf87-32ba-40c3-80ca-c92072639df2
1401829130.0,imgur.com,278gci,47,65,08e01c25-8ab2-4127-8983-5fbd477029c5,1926,funny,Thaks!,http://i.imgur.com/e7ocYZT.jpg,0,e1cedf87-32ba-40c3-80ca-c92072639df2
1401813751.0,i.imgur.com,277pec,133,65,08e01c25-8ab2-4127-8983-5fbd477029c5,2415,funny,Mom busted out a box of old santa letters today- looks like my career as a smartass began at a young age,http://i.imgur.com/J0mxXkF.jpg,1,e1cedf87-32ba-40c3-80ca-c92072639df2
1401561347.0,imgur.com,26z1ri,330,66,08e01c25-8ab2-4127-8983-5fbd477029c5,2722,funny,"Brush the cat my girlfriend said, it'll be fun she said.",http://i.imgur.com/oZwAgGX.jpg,0,e1cedf87-32ba-40c3-80ca-c92072639df2
1401560682.0,i.imgur.com,26z0ty,3639,66,08e01c25-8ab2-4127-8983-5fbd477029c5,3478,funny,Jaden Smith wore a white batman costume to Kim and Kanye's wedding,http://i.imgur.com/FD2GdxJ.jpg,1,e1cedf87-32ba-40c3-80ca-c92072639df2
1401544199.0,i.imgur.com,26yfbj,1431,67,08e01c25-8ab2-4127-8983-5fbd477029c5,2395,funny,This is one of the funniest things I have seen in a while,http://i.imgur.com/U5q5qYE.jpg,0,e1cedf87-32ba-40c3-80ca-c92072639df2
1401548837.0,i.imgur.com,26ykxu,113,67,08e01c25-8ab2-4127-8983-5fbd477029c5,2064,funny,9 simple words to remember when someone asks if this is a repost,http://i.imgur.com/H2nZKO0.jpg,1,e1cedf87-32ba-40c3-80ca-c92072639df2
