created,domain,id,num_comments,question_id,quiz_id,score,subreddit,title,url,image_pair_id,quiz_cluster
1401762660.0,i.imgur.com,2762hq,46,64,b9945911-3f2b-44ac-9ff2-cb4d72fbbe8a,2165,pics,My wife snapped this picture of a raccoon in Lake Tahoe. He looks like a bartender waiting for a customer.,http://i.imgur.com/8cQB3Ud.jpg,1,7bf2ce94-6daa-4d04-8fd6-2e519606b48c
1401081468.0,imgur.com,26i0k4,415,65,b9945911-3f2b-44ac-9ff2-cb4d72fbbe8a,2921,pics,"Today, Fabio picked me up at Whole Foods",http://i.imgur.com/y97Lpc9.jpg,0,7bf2ce94-6daa-4d04-8fd6-2e519606b48c
1401081468.0,imgur.com,26i0k4,415,65,b9945911-3f2b-44ac-9ff2-cb4d72fbbe8a,2921,pics,"Today, Fabio picked me up at Whole Foods",http://i.imgur.com/y97Lpc9.jpg,1,7bf2ce94-6daa-4d04-8fd6-2e519606b48c
1401328099.0,i.imgur.com,26r0wg,25,66,b9945911-3f2b-44ac-9ff2-cb4d72fbbe8a,148,pics,Lightning Strike Scars - The marks left behind when lightning strikes a human being,http://i.imgur.com/VQOkuCZ.jpg,0,7bf2ce94-6daa-4d04-8fd6-2e519606b48c
1401328099.0,i.imgur.com,26r0wg,25,66,b9945911-3f2b-44ac-9ff2-cb4d72fbbe8a,148,pics,Lightning Strike Scars - The marks left behind when lightning strikes a human being,http://i.imgur.com/VQOkuCZ.jpg,1,7bf2ce94-6daa-4d04-8fd6-2e519606b48c
1401812358.0,imgur.com,277n1u,24,67,b9945911-3f2b-44ac-9ff2-cb4d72fbbe8a,180,pics,Went to the Comcast store here in town because I wasn't getting anywhere on the phone. This is where they send me.,http://i.imgur.com/YwO6Ipd.jpg,0,7bf2ce94-6daa-4d04-8fd6-2e519606b48c
1401773362.0,i.imgur.com,276gkz,121,67,b9945911-3f2b-44ac-9ff2-cb4d72fbbe8a,839,pics,My friend just got her hair dyed...,http://i.imgur.com/PmjT4gK.jpg,1,7bf2ce94-6daa-4d04-8fd6-2e519606b48c
1401976812.0,i.imgur.com,27drlu,386,68,b9945911-3f2b-44ac-9ff2-cb4d72fbbe8a,3759,pics,A young Saddam Hussein with his female companion. What a charmer!,http://i.imgur.com/a6QvQF6.jpg,0,7bf2ce94-6daa-4d04-8fd6-2e519606b48c
1401979702.0,imgur.com,27dvzg,1263,68,b9945911-3f2b-44ac-9ff2-cb4d72fbbe8a,4153,pics,stunning 1950s necklines,http://i.imgur.com/RotYhyI.jpg,1,7bf2ce94-6daa-4d04-8fd6-2e519606b48c
1401646776.0,i.imgur.com,271nk7,47,69,b9945911-3f2b-44ac-9ff2-cb4d72fbbe8a,742,pics,Don't forget it's race day!,http://i.imgur.com/aUXoOTm.jpg,0,7bf2ce94-6daa-4d04-8fd6-2e519606b48c
1401628926.0,imgur.com,2710iw,17,69,b9945911-3f2b-44ac-9ff2-cb4d72fbbe8a,1391,pics,"Hollywood, 1959",http://i.imgur.com/nBMnt1G.jpg,1,7bf2ce94-6daa-4d04-8fd6-2e519606b48c
1401748448.0,i.imgur.com,275gj7,58,70,b9945911-3f2b-44ac-9ff2-cb4d72fbbe8a,3214,pics,Ferocious White Tiger,http://i.imgur.com/TPdw4sV.jpg,0,7bf2ce94-6daa-4d04-8fd6-2e519606b48c
1401813297.0,i.imgur.com,277onc,13,70,b9945911-3f2b-44ac-9ff2-cb4d72fbbe8a,203,pics,With a little help from my friends.,http://i.imgur.com/ByaImrO.jpg,1,7bf2ce94-6daa-4d04-8fd6-2e519606b48c
1401481873.0,i.imgur.com,26wk2d,105,71,b9945911-3f2b-44ac-9ff2-cb4d72fbbe8a,1647,pics,16 stories beneath midtown Manhattan,http://i.imgur.com/jvoS378.jpg,0,7bf2ce94-6daa-4d04-8fd6-2e519606b48c
1401458278.0,imgur.com,26vhs2,35,71,b9945911-3f2b-44ac-9ff2-cb4d72fbbe8a,1761,pics,Went for a walk this morning. Glad I did.,http://i.imgur.com/3yCPFEm.jpg,1,7bf2ce94-6daa-4d04-8fd6-2e519606b48c
1401550103.0,i.imgur.com,26ymjw,21,72,b9945911-3f2b-44ac-9ff2-cb4d72fbbe8a,334,pics,"Woke up to this today, I was so startled",http://i.imgur.com/N4eiLRm.jpg,0,7bf2ce94-6daa-4d04-8fd6-2e519606b48c
1401496437.0,i.imgur.com,26x605,69,72,b9945911-3f2b-44ac-9ff2-cb4d72fbbe8a,2632,pics,"A picture of a 1987 Corvette, with a model of a 1987 Corvette in the window, with a model of a 1987 Corvette in the window",http://i.imgur.com/TQincUm.jpg,1,7bf2ce94-6daa-4d04-8fd6-2e519606b48c
1401887953.0,i.imgur.com,27aeoe,63,73,b9945911-3f2b-44ac-9ff2-cb4d72fbbe8a,693,pics,Apparently a golf cart blew up at my friend's golf course,http://i.imgur.com/jyOrBM8.jpg,0,7bf2ce94-6daa-4d04-8fd6-2e519606b48c
1401895259.0,i.imgur.com,27apax,86,73,b9945911-3f2b-44ac-9ff2-cb4d72fbbe8a,285,pics,"It finally happened to me, thanks to reddit I know what my girlfriend just got.....",http://i.imgur.com/QzenS74.jpg,1,7bf2ce94-6daa-4d04-8fd6-2e519606b48c
1401549791.0,i.imgur.com,26ym6s,245,74,b9945911-3f2b-44ac-9ff2-cb4d72fbbe8a,3410,pics,Saving the planet with 500% more packaging!,http://i.imgur.com/7Xh1Hwa.jpg,0,7bf2ce94-6daa-4d04-8fd6-2e519606b48c
1401552125.0,i.imgur.com,26yp3y,704,74,b9945911-3f2b-44ac-9ff2-cb4d72fbbe8a,3881,pics,"Excuse me, sir, do you know where I could find some enlightenment?",http://i.imgur.com/mbgmcua.jpg,1,7bf2ce94-6daa-4d04-8fd6-2e519606b48c
1401884094.0,i.imgur.com,27aa8j,5,75,b9945911-3f2b-44ac-9ff2-cb4d72fbbe8a,274,pics,"If I don't move, he can't see me right?",http://i.imgur.com/VGdHb6i.jpg,0,7bf2ce94-6daa-4d04-8fd6-2e519606b48c
1401825252.0,i.imgur.com,2789ea,661,75,b9945911-3f2b-44ac-9ff2-cb4d72fbbe8a,3692,pics,Hollow point bullet flowers,http://i.imgur.com/2qjN9yO.jpg,1,7bf2ce94-6daa-4d04-8fd6-2e519606b48c
1401760760.0,i.imgur.com,275zmc,18,76,b9945911-3f2b-44ac-9ff2-cb4d72fbbe8a,205,pics,"My friend went to Dubrovnik, Croatia, and recreated the exact scene her mother was in 40 years ago.",http://i.imgur.com/YLQWKF0.jpg,0,7bf2ce94-6daa-4d04-8fd6-2e519606b48c
1401759632.0,i.imgur.com,275xxm,31,76,b9945911-3f2b-44ac-9ff2-cb4d72fbbe8a,245,pics,A friend of mine found the biggest shark's tooth I have ever seen,http://i.imgur.com/12vnN0G.jpg,1,7bf2ce94-6daa-4d04-8fd6-2e519606b48c
1401392283.0,i.imgur.com,26t94l,502,77,b9945911-3f2b-44ac-9ff2-cb4d72fbbe8a,2724,pics,Took my son to the zoo today.,http://i.imgur.com/ThchcZI.jpg,0,7bf2ce94-6daa-4d04-8fd6-2e519606b48c
1401386719.0,i.imgur.com,26szno,543,77,b9945911-3f2b-44ac-9ff2-cb4d72fbbe8a,3921,pics,"My mother gave me zero context for this photo aside from ""I think it was taken in Virginia Beach""",http://i.imgur.com/x6qCgjf.jpg,1,7bf2ce94-6daa-4d04-8fd6-2e519606b48c
1401551246.0,i.imgur.com,26yo0a,922,78,b9945911-3f2b-44ac-9ff2-cb4d72fbbe8a,3065,pics,What does reddit think of this knick knack shelf I made of a single piece of plywood?,http://i.imgur.com/VDjDDwx.jpg,0,7bf2ce94-6daa-4d04-8fd6-2e519606b48c
1401556051.0,i.imgur.com,26yuer,636,78,b9945911-3f2b-44ac-9ff2-cb4d72fbbe8a,2154,pics,I too have been waiting for this day! (girlfriend in the background),http://i.imgur.com/TUc0Zry.jpg,1,7bf2ce94-6daa-4d04-8fd6-2e519606b48c
1401105758.0,imgur.com,26ikqp,48,79,b9945911-3f2b-44ac-9ff2-cb4d72fbbe8a,831,pics,Genius idea,http://i.imgur.com/jN7hHS1.jpg,0,7bf2ce94-6daa-4d04-8fd6-2e519606b48c
1401118456.0,i.imgur.com,26iyzk,13,79,b9945911-3f2b-44ac-9ff2-cb4d72fbbe8a,442,pics,"18,000 soldiers form the Statue of Liberty in 1819.",http://i.imgur.com/BtVAT2k.jpg,1,7bf2ce94-6daa-4d04-8fd6-2e519606b48c
1401786623.0,i.imgur.com,276s3k,14,80,b9945911-3f2b-44ac-9ff2-cb4d72fbbe8a,440,pics,Albino peacock opening up at Nogayama zoo,http://i.imgur.com/kahDQCu.jpg,0,7bf2ce94-6daa-4d04-8fd6-2e519606b48c
1401742472.0,i.imgur.com,2756f9,609,80,b9945911-3f2b-44ac-9ff2-cb4d72fbbe8a,3620,pics,I was kicked out of a hot air balloon yesterday,http://i.imgur.com/IjcULWN.jpg,1,7bf2ce94-6daa-4d04-8fd6-2e519606b48c
1401881830.0,i.imgur.com,27a80m,46,81,b9945911-3f2b-44ac-9ff2-cb4d72fbbe8a,605,pics,Elizabeth Hurley in her punk days,http://i.imgur.com/kIxRgFg.jpg,0,7bf2ce94-6daa-4d04-8fd6-2e519606b48c
1401843826.0,i.imgur.com,2793om,451,81,b9945911-3f2b-44ac-9ff2-cb4d72fbbe8a,1976,pics,Can this please happen?,http://i.imgur.com/kx9hbvx.jpg,1,7bf2ce94-6daa-4d04-8fd6-2e519606b48c
1401271563.0,i.imgur.com,26ompr,5,83,b9945911-3f2b-44ac-9ff2-cb4d72fbbe8a,195,pics,"Ferrofluid is a magnetic, hydrophobic liquid that forms colorful curves and channels when deposited onto a magnet and injected with watercolor paints",http://i.imgur.com/kMchrje.jpg,1,7bf2ce94-6daa-4d04-8fd6-2e519606b48c
1401503876.0,i.imgur.com,26xfk4,10,84,b9945911-3f2b-44ac-9ff2-cb4d72fbbe8a,160,pics,"Freaky clouds over Sacandaga Lake, NY.",http://i.imgur.com/hzS06aD.jpg,0,7bf2ce94-6daa-4d04-8fd6-2e519606b48c
1401472331.0,i.imgur.com,26w4b0,25,84,b9945911-3f2b-44ac-9ff2-cb4d72fbbe8a,169,pics,Central African Republic child soldier,http://i.imgur.com/y1yp6eF.jpg,1,7bf2ce94-6daa-4d04-8fd6-2e519606b48c
1401659260.0,i.imgur.com,27262h,232,85,b9945911-3f2b-44ac-9ff2-cb4d72fbbe8a,3097,pics,Ancient Rome,http://i.imgur.com/u1bBlwg.jpg,0,7bf2ce94-6daa-4d04-8fd6-2e519606b48c
1401662020.0,i.imgur.com,272a7q,664,85,b9945911-3f2b-44ac-9ff2-cb4d72fbbe8a,3297,pics,This is what you must do if you accidentally drop a bottle of red wine,http://i.imgur.com/WJz84TV.jpg,1,7bf2ce94-6daa-4d04-8fd6-2e519606b48c
1401234326.0,i.imgur.com,26nfr2,231,86,b9945911-3f2b-44ac-9ff2-cb4d72fbbe8a,3743,pics,"I work in the oil patch, and don't get to see beautiful moments like this every day.",http://i.imgur.com/LSQn53d.jpg,0,7bf2ce94-6daa-4d04-8fd6-2e519606b48c
1401237672.0,i.imgur.com,26nkuq,655,86,b9945911-3f2b-44ac-9ff2-cb4d72fbbe8a,4020,pics,So it hailed in South Dakota today...,http://i.imgur.com/HcjGusI.png,1,7bf2ce94-6daa-4d04-8fd6-2e519606b48c
1401188898.0,i.imgur.com,26lhht,1627,87,b9945911-3f2b-44ac-9ff2-cb4d72fbbe8a,2984,pics,Palestinian woman collects gas bombs fired by Israeli Army. She grows flowers in them.,http://i.imgur.com/va8187C.jpg,0,7bf2ce94-6daa-4d04-8fd6-2e519606b48c
1401214400.0,i.imgur.com,26mhye,29,87,b9945911-3f2b-44ac-9ff2-cb4d72fbbe8a,828,pics,I won't lie - the timing was a complete accident.,http://i.imgur.com/Jzv7hxJ.jpg,1,7bf2ce94-6daa-4d04-8fd6-2e519606b48c
1401709120.0,i.imgur.com,273qsx,398,88,b9945911-3f2b-44ac-9ff2-cb4d72fbbe8a,2659,pics,"Met these two in a Parisian train station on their way to Normandy, for the 70 years D-Day memorial. respect.",http://i.imgur.com/Z3vScwJ.jpg,0,7bf2ce94-6daa-4d04-8fd6-2e519606b48c
1401737142.0,imgur.com,274wsd,19,88,b9945911-3f2b-44ac-9ff2-cb4d72fbbe8a,742,pics,Check out the AMAZING mailbox at-at this house...,http://i.imgur.com/BSxaHtk.jpg,1,7bf2ce94-6daa-4d04-8fd6-2e519606b48c
1401215071.0,i.imgur.com,26mj5b,25,89,b9945911-3f2b-44ac-9ff2-cb4d72fbbe8a,1366,pics,Walked past a construction site. Saw two familiar characters...,http://i.imgur.com/jWMMGcc.jpg,0,7bf2ce94-6daa-4d04-8fd6-2e519606b48c
1401241277.0,i.imgur.com,26nqgl,43,89,b9945911-3f2b-44ac-9ff2-cb4d72fbbe8a,398,pics,I trust him.,http://i.imgur.com/seHtHmn.jpg,1,7bf2ce94-6daa-4d04-8fd6-2e519606b48c
1401281332.0,i.imgur.com,26ow06,31,90,b9945911-3f2b-44ac-9ff2-cb4d72fbbe8a,949,pics,So this is how the morning is going to start.,http://i.imgur.com/KJMR2yr.jpg,0,7bf2ce94-6daa-4d04-8fd6-2e519606b48c
1401281332.0,i.imgur.com,26ow06,31,90,b9945911-3f2b-44ac-9ff2-cb4d72fbbe8a,949,pics,So this is how the morning is going to start.,http://i.imgur.com/KJMR2yr.jpg,1,7bf2ce94-6daa-4d04-8fd6-2e519606b48c
1401299449.0,i.imgur.com,26poq7,247,91,b9945911-3f2b-44ac-9ff2-cb4d72fbbe8a,2895,pics,My boss says I look like Frank Zappa,http://i.imgur.com/n1b2rWW.jpg,0,7bf2ce94-6daa-4d04-8fd6-2e519606b48c
1401298452.0,i.imgur.com,26pmza,641,91,b9945911-3f2b-44ac-9ff2-cb4d72fbbe8a,3648,pics,A megalodon tooth stuck in a whale vertebrae. This is the most badass fossil in existence.,http://i.imgur.com/lb0CtaX.jpg,1,7bf2ce94-6daa-4d04-8fd6-2e519606b48c
1401051845.0,i.imgur.com,26gyqf,280,92,b9945911-3f2b-44ac-9ff2-cb4d72fbbe8a,3233,pics,Realgar crystals within Earth core sample (X-Post /r/woahdude),http://i.imgur.com/LsgyBCM.jpg,0,7bf2ce94-6daa-4d04-8fd6-2e519606b48c
1401057765.0,imgur.com,26h6va,34,92,b9945911-3f2b-44ac-9ff2-cb4d72fbbe8a,2199,pics,"Another year older, another year of not giving a shit.",http://i.imgur.com/WJwDQl0.jpg,1,7bf2ce94-6daa-4d04-8fd6-2e519606b48c
1401884335.0,i.imgur.com,27aai7,479,93,b9945911-3f2b-44ac-9ff2-cb4d72fbbe8a,3228,pics,"I am an oyster farmer in New England, and sometimes this is what 200,000 oysters look like",http://i.imgur.com/64jBIVG.jpg,0,7bf2ce94-6daa-4d04-8fd6-2e519606b48c
1401893025.0,i.imgur.com,27alt7,58,93,b9945911-3f2b-44ac-9ff2-cb4d72fbbe8a,2468,pics,This guy kept staring at me like we had a problem.,http://i.imgur.com/dGFRpha.jpg,1,7bf2ce94-6daa-4d04-8fd6-2e519606b48c
1401420429.0,i.imgur.com,26uh69,713,94,b9945911-3f2b-44ac-9ff2-cb4d72fbbe8a,3549,pics,So my neighbor nursed a sick crow back to health....now he chills and is cool. His name is Frank. He even sat on my shoulder and hung out!,http://i.imgur.com/3vKVinl.jpg,0,7bf2ce94-6daa-4d04-8fd6-2e519606b48c
1401497270.0,i.imgur.com,26x74k,22,94,b9945911-3f2b-44ac-9ff2-cb4d72fbbe8a,90,pics,Mosquitos feasting on a blood-bag,http://i.imgur.com/ep0Utab.jpg,1,7bf2ce94-6daa-4d04-8fd6-2e519606b48c
1401240585.0,i.imgur.com,26npch,66,95,b9945911-3f2b-44ac-9ff2-cb4d72fbbe8a,2414,pics,"Robert De Niro with his father, Robert De Niro Sr.",http://i.imgur.com/zenYKFU.jpg,0,7bf2ce94-6daa-4d04-8fd6-2e519606b48c
1401282069.0,ppcdn.500px.org,26owvy,18,95,b9945911-3f2b-44ac-9ff2-cb4d72fbbe8a,376,pics,This picture taken in Iceland in the late afternoon. On the picture is a little church made from wood and peat (turf). Is one of the last peat churches in Iceland. The humps in the grass are ancient graves.,http://i.imgur.com/gooPC.png,1,7bf2ce94-6daa-4d04-8fd6-2e519606b48c
1401636298.0,i.imgur.com,2718vf,537,96,b9945911-3f2b-44ac-9ff2-cb4d72fbbe8a,3030,pics,Finally saw one in real life. The F650.,http://i.imgur.com/JBAbnKA.jpg,0,7bf2ce94-6daa-4d04-8fd6-2e519606b48c
1401667052.0,imgur.com,272hdn,29,96,b9945911-3f2b-44ac-9ff2-cb4d72fbbe8a,682,pics,"Just my friend standing on a path with crazy cool lighting. Thought it needed a place somewhere, this probably isn't it (sorry",http://i.imgur.com/oPu48sw.jpg,1,7bf2ce94-6daa-4d04-8fd6-2e519606b48c
1401591262.0,i.imgur.com,27056c,9,97,b9945911-3f2b-44ac-9ff2-cb4d72fbbe8a,283,pics,"Green mall in Osaka, Japan.",http://i.imgur.com/nIbqLks.jpg,0,7bf2ce94-6daa-4d04-8fd6-2e519606b48c
1401542551.0,imgur.com,26ydow,158,97,b9945911-3f2b-44ac-9ff2-cb4d72fbbe8a,2041,pics,My wife said I could post a pic of her in her bathing suit. Here she is.,http://i.imgur.com/Xtg55cF.jpg,1,7bf2ce94-6daa-4d04-8fd6-2e519606b48c
1401986669.0,i.imgur.com,27e7jr,197,98,b9945911-3f2b-44ac-9ff2-cb4d72fbbe8a,2559,pics,My new hand-made wooden iPhone case with a cultural history,http://i.imgur.com/LqxW1Rv.jpg,0,7bf2ce94-6daa-4d04-8fd6-2e519606b48c
1401999051.0,i.imgur.com,27et4b,51,98,b9945911-3f2b-44ac-9ff2-cb4d72fbbe8a,1481,pics,Went to the zoo and found a bear in deep thought,http://i.imgur.com/8krSJjG.jpg,1,7bf2ce94-6daa-4d04-8fd6-2e519606b48c
1401148827.0,imgur.com,26k9tk,68,99,b9945911-3f2b-44ac-9ff2-cb4d72fbbe8a,1956,pics,My brother took this picture during Fleet Week of NYC,http://i.imgur.com/5695N7M.jpg,0,7bf2ce94-6daa-4d04-8fd6-2e519606b48c
1401139198.0,imgur.com,26jvhe,275,99,b9945911-3f2b-44ac-9ff2-cb4d72fbbe8a,3350,pics,How to transport sand.,http://i.imgur.com/wPt7eC8.jpg,1,7bf2ce94-6daa-4d04-8fd6-2e519606b48c
1401940599.0,i.imgur.com,27cs9x,493,0,405494ef-bd08-400b-b682-4f97cb4349e5,2987,pics,What a nice family photo.,http://i.imgur.com/yHsYOAJ.jpg,0,7bf2ce94-6daa-4d04-8fd6-2e519606b48c
1401139198.0,imgur.com,26jvhe,275,0,405494ef-bd08-400b-b682-4f97cb4349e5,3350,pics,How to transport sand.,http://i.imgur.com/wPt7eC8.jpg,1,7bf2ce94-6daa-4d04-8fd6-2e519606b48c
1401974857.0,i.imgur.com,27doxw,429,1,405494ef-bd08-400b-b682-4f97cb4349e5,2449,pics,"Exactly 29 years ago today, this guy taught us that life moves pretty fast, and if we don't stop and take a look around once and a while, we'll miss it.",http://i.imgur.com/5RiQ34y.png,0,7bf2ce94-6daa-4d04-8fd6-2e519606b48c
1401941057.0,i.imgur.com,27csxs,811,1,405494ef-bd08-400b-b682-4f97cb4349e5,4173,pics,"Instead of a dead bird or mouse, my cat decides to bring us gifts of leaves. She's been doing this for years.",http://i.imgur.com/OXYCooM.jpg,1,7bf2ce94-6daa-4d04-8fd6-2e519606b48c
1401804669.0,i.imgur.com,277an0,1624,2,405494ef-bd08-400b-b682-4f97cb4349e5,2208,pics,21 years of school later: 1st day of kindergarten and last day of medical school,http://i.imgur.com/yXk6LlV.jpg,0,7bf2ce94-6daa-4d04-8fd6-2e519606b48c
1401969564.0,i.imgur.com,27ditp,462,2,405494ef-bd08-400b-b682-4f97cb4349e5,3257,pics,So someone on my road is taking the law into their own hands,http://i.imgur.com/SrnIMCA.jpg,1,7bf2ce94-6daa-4d04-8fd6-2e519606b48c
1401482119.0,imgur.com,26wkgt,4994,3,405494ef-bd08-400b-b682-4f97cb4349e5,3280,pics,"I work at a restaurant, some dude left this in a coworkers check last night",http://i.imgur.com/ztbpfNY.jpg,0,7bf2ce94-6daa-4d04-8fd6-2e519606b48c
1401806943.0,i.imgur.com,277e3p,32,3,405494ef-bd08-400b-b682-4f97cb4349e5,1816,pics,Snails,http://i.imgur.com/lAkPeyd.jpg,1,7bf2ce94-6daa-4d04-8fd6-2e519606b48c
1401368685.0,imgur.com,26s70m,127,4,405494ef-bd08-400b-b682-4f97cb4349e5,3931,pics,Just hanging out,http://i.imgur.com/3PJNCCa.jpg,0,7bf2ce94-6daa-4d04-8fd6-2e519606b48c
1401494907.0,i.imgur.com,26x3yt,791,4,405494ef-bd08-400b-b682-4f97cb4349e5,2782,pics,This guy wore the same outfit on his last day of high school as his first day of preschool.,http://i.imgur.com/GLjSdeH.jpg,1,7bf2ce94-6daa-4d04-8fd6-2e519606b48c
1402012787.0,i.imgur.com,27ffhz,205,5,405494ef-bd08-400b-b682-4f97cb4349e5,3763,pics,Massive hurricane on Saturn,http://i.imgur.com/II0LSA8.jpg,0,7bf2ce94-6daa-4d04-8fd6-2e519606b48c
1401368297.0,i.imgur.com,26s6je,502,5,405494ef-bd08-400b-b682-4f97cb4349e5,3386,pics,"The note in Japanese says, ""I accidentally knocked over your bike and broke the bell. I am very sorry.""",http://i.imgur.com/N3RFxeq.jpg,1,7bf2ce94-6daa-4d04-8fd6-2e519606b48c
1401287831.0,i.imgur.com,26p58z,211,6,405494ef-bd08-400b-b682-4f97cb4349e5,3504,pics,"400,000-year-old calcified skull of hominid found in Altamura Cave.",http://i.imgur.com/3WELhvp.jpg,0,7bf2ce94-6daa-4d04-8fd6-2e519606b48c
1402013327.0,i.imgur.com,27fgay,240,6,405494ef-bd08-400b-b682-4f97cb4349e5,3313,pics,"My cousin let her son pick out his clothes for a trip to Publix. Her response to his choice: ""If you can't do that when you're a kid then when can you?""",http://i.imgur.com/IJZtBjg.jpg,1,7bf2ce94-6daa-4d04-8fd6-2e519606b48c
1401650256.0,imgur.com,271sk9,496,7,405494ef-bd08-400b-b682-4f97cb4349e5,2976,pics,"Today I had the pleasure of becoming acquainted with this man, Preston, who is a 103-year-old singer and veteran. Every day at the same time he walks past my work and puts the rest of men in this city to shame with his impeccable style and positive demeanor.",http://i.imgur.com/vpKNYfK.jpg,0,7bf2ce94-6daa-4d04-8fd6-2e519606b48c
1401293631.0,i.imgur.com,26peru,90,7,405494ef-bd08-400b-b682-4f97cb4349e5,2624,pics,Glowing Mushrooms in Japan,http://i.imgur.com/VWf2XaC.jpg,1,7bf2ce94-6daa-4d04-8fd6-2e519606b48c
1401219330.0,i.imgur.com,26mqlh,280,8,405494ef-bd08-400b-b682-4f97cb4349e5,3429,pics,This Nerf dart has been stuck to the side of a skybridge at my university for over two years,http://i.imgur.com/kLesiXF.jpg,0,7bf2ce94-6daa-4d04-8fd6-2e519606b48c
1401660787.0,i.imgur.com,2728bz,161,8,405494ef-bd08-400b-b682-4f97cb4349e5,3630,pics,Creative use of cinder blocks,http://i.imgur.com/PvDVv0v.jpg,1,7bf2ce94-6daa-4d04-8fd6-2e519606b48c
1401219330.0,i.imgur.com,26mqlh,280,9,405494ef-bd08-400b-b682-4f97cb4349e5,3429,pics,This Nerf dart has been stuck to the side of a skybridge at my university for over two years,http://i.imgur.com/kLesiXF.jpg,1,7bf2ce94-6daa-4d04-8fd6-2e519606b48c
1401582746.0,imgur.com,26zuur,451,10,405494ef-bd08-400b-b682-4f97cb4349e5,3979,pics,"Welcome To Fabulous Las Vegas, Nevada!",http://i.imgur.com/OJfxY4H.jpg,0,7bf2ce94-6daa-4d04-8fd6-2e519606b48c
1401103175.0,i.imgur.com,26iims,85,10,405494ef-bd08-400b-b682-4f97cb4349e5,1891,pics,A intact pool between the dirty water of a flood in Germany.,http://i.imgur.com/uXQNPXK.jpg,1,7bf2ce94-6daa-4d04-8fd6-2e519606b48c
1401189861.0,i.imgur.com,26libw,87,11,405494ef-bd08-400b-b682-4f97cb4349e5,1924,pics,Abandoned ship on the coast of Mauritania,http://i.imgur.com/hWDF9DX.jpg,0,7bf2ce94-6daa-4d04-8fd6-2e519606b48c
1401594259.0,i.imgur.com,2708qa,174,11,405494ef-bd08-400b-b682-4f97cb4349e5,3593,pics,Aztec Dancer,http://i.imgur.com/Ekawxi4.jpg,1,7bf2ce94-6daa-4d04-8fd6-2e519606b48c
1401455799.0,i.imgur.com,26veha,144,12,405494ef-bd08-400b-b682-4f97cb4349e5,3431,pics,Hermit crab in a glass shell. Neat.,http://i.imgur.com/M4clwD5.jpg,0,7bf2ce94-6daa-4d04-8fd6-2e519606b48c
1401188898.0,i.imgur.com,26lhht,1627,12,405494ef-bd08-400b-b682-4f97cb4349e5,2978,pics,Palestinian woman collects gas bombs fired by Israeli Army. She grows flowers in them.,http://i.imgur.com/va8187C.jpg,1,7bf2ce94-6daa-4d04-8fd6-2e519606b48c
1401687747.0,i.imgur.com,27397w,888,13,405494ef-bd08-400b-b682-4f97cb4349e5,7525,pics,"Mother cat walks through flames 5 times to save kittens from building fire in Brooklyn, NY.",http://i.imgur.com/A6jU0wt.jpg,0,7bf2ce94-6daa-4d04-8fd6-2e519606b48c
1401445119.0,i.imgur.com,26v49n,341,13,405494ef-bd08-400b-b682-4f97cb4349e5,4002,pics,"Smart watch, 1984 style",http://i.imgur.com/vhrZF9a.jpg,1,7bf2ce94-6daa-4d04-8fd6-2e519606b48c
1401047869.0,i.imgur.com,26gt75,794,14,405494ef-bd08-400b-b682-4f97cb4349e5,2896,pics,"The pope looking at graffiti while on his visit in the holy land. ""Pope we need some 1 to speak about justice"". Shows his character when he takes the time to read a message from someone who couldn't approach him directly.",http://i.imgur.com/5J0k5jr.jpg,0,7bf2ce94-6daa-4d04-8fd6-2e519606b48c
1401718215.0,i.imgur.com,2741bs,58,14,405494ef-bd08-400b-b682-4f97cb4349e5,1418,pics,When people try to tickle my neck,http://i.imgur.com/DoITlPI.jpg,1,7bf2ce94-6daa-4d04-8fd6-2e519606b48c
1401059128.0,i.imgur.com,26h8ob,301,15,405494ef-bd08-400b-b682-4f97cb4349e5,2994,pics,"Oil painting of exploding sharks and skydivers that I made (it's really a painting, I swear!)",http://i.imgur.com/BqLameF.jpg,0,7bf2ce94-6daa-4d04-8fd6-2e519606b48c
1401047548.0,i.imgur.com,26gssu,707,15,405494ef-bd08-400b-b682-4f97cb4349e5,3970,pics,The world's tallest Lego tower was built in Budapest today,http://i.imgur.com/gZVvBKA.jpg,1,7bf2ce94-6daa-4d04-8fd6-2e519606b48c
1401363427.0,i.imgur.com,26s1dd,46,16,405494ef-bd08-400b-b682-4f97cb4349e5,2599,pics,Baby Flying Fish,http://i.imgur.com/DFjVUEj.jpg,0,7bf2ce94-6daa-4d04-8fd6-2e519606b48c
1401059345.0,i.imgur.com,26h8yj,79,16,405494ef-bd08-400b-b682-4f97cb4349e5,2944,pics,A forest,http://i.imgur.com/CeW20Ft.jpg,1,7bf2ce94-6daa-4d04-8fd6-2e519606b48c
1401665265.0,i.imgur.com,272es9,82,17,405494ef-bd08-400b-b682-4f97cb4349e5,3088,pics,Double take upon waking this morning.,http://i.imgur.com/RnDgYQt.jpg,0,7bf2ce94-6daa-4d04-8fd6-2e519606b48c
1401363471.0,i.imgur.com,26s1ex,80,17,405494ef-bd08-400b-b682-4f97cb4349e5,3275,pics,A view of the city of Shanghai.,http://i.imgur.com/VgCiEQj.jpg,1,7bf2ce94-6daa-4d04-8fd6-2e519606b48c
1401762492.0,i.imgur.com,276296,597,18,405494ef-bd08-400b-b682-4f97cb4349e5,2292,pics,Not yet 130lbs down but here's a 120lb face transformation,http://i.imgur.com/xUp8VMd.jpg,0,7bf2ce94-6daa-4d04-8fd6-2e519606b48c
1401665265.0,i.imgur.com,272es9,82,18,405494ef-bd08-400b-b682-4f97cb4349e5,3088,pics,Double take upon waking this morning.,http://i.imgur.com/RnDgYQt.jpg,1,7bf2ce94-6daa-4d04-8fd6-2e519606b48c
1401189104.0,i.imgur.com,26lhnr,75,19,405494ef-bd08-400b-b682-4f97cb4349e5,871,pics,River outlet tubes during a high flow release from the Glen Canyon Dam.,http://i.imgur.com/Un7LBuQ.jpg,0,7bf2ce94-6daa-4d04-8fd6-2e519606b48c
1401750559.0,i.imgur.com,275jz0,2157,19,405494ef-bd08-400b-b682-4f97cb4349e5,4723,pics,"At first I thought he was crazy, now I think my friend knows what he's doing.",http://i.imgur.com/4dhMqw2.jpg,1,7bf2ce94-6daa-4d04-8fd6-2e519606b48c
1402009522.0,imgur.com,27faq0,377,20,405494ef-bd08-400b-b682-4f97cb4349e5,4032,pics,I've seen a lot of interesting things wash up on shore but this takes the cake.,http://i.imgur.com/64QF9ob.jpg,0,7bf2ce94-6daa-4d04-8fd6-2e519606b48c
1401152702.0,imgur.com,26kff5,99,20,405494ef-bd08-400b-b682-4f97cb4349e5,2417,pics,My boyfriend walked into the bathroom a few days ago and found the cat like this.,http://i.imgur.com/0gArFIn.jpg,1,7bf2ce94-6daa-4d04-8fd6-2e519606b48c
1401574398.0,i.imgur.com,26zk5y,156,21,405494ef-bd08-400b-b682-4f97cb4349e5,3465,pics,"Bryce Canyon - I was taking a picture of a sign when a raven landed on it, making it look kind of ominous.",http://i.imgur.com/QSf9F.jpg,0,7bf2ce94-6daa-4d04-8fd6-2e519606b48c
1402007427.0,i.imgur.com,27f7f6,543,21,405494ef-bd08-400b-b682-4f97cb4349e5,2763,pics,"Over two years ago, we got our first and only foster kids. Today, they are no longer in the system. They are now in a forever home and we could not be more proud to call them our own.",http://i.imgur.com/ytjD6jx.jpg,1,7bf2ce94-6daa-4d04-8fd6-2e519606b48c
1401192659.0,i.imgur.com,26ll1c,28,22,405494ef-bd08-400b-b682-4f97cb4349e5,1170,pics,Kea in mid-flight,http://i.imgur.com/Wc8ULrx.jpg,0,7bf2ce94-6daa-4d04-8fd6-2e519606b48c
1401581913.0,i.imgur.com,26ztt4,172,22,405494ef-bd08-400b-b682-4f97cb4349e5,3560,pics,I caught a picture this tree trying to crawl into the water,http://i.imgur.com/VWnZ9Vb.jpg,1,7bf2ce94-6daa-4d04-8fd6-2e519606b48c
1401139624.0,imgur.com,26jw54,260,23,405494ef-bd08-400b-b682-4f97cb4349e5,3085,pics,An albino spider that lives in my garden... never seen one this color before.,http://i.imgur.com/l9fjIXT.jpg,0,7bf2ce94-6daa-4d04-8fd6-2e519606b48c
1401193837.0,i.imgur.com,26lmc0,31,23,405494ef-bd08-400b-b682-4f97cb4349e5,813,pics,I took this picture of a rock formation in a cave. It looks like a wet towel hanging down. It's thin enough that the light shines through.,http://i.imgur.com/0aFPjP7.jpg,1,7bf2ce94-6daa-4d04-8fd6-2e519606b48c
1401219894.0,i.imgur.com,26mriw,572,24,405494ef-bd08-400b-b682-4f97cb4349e5,3246,pics,Exactly one more year until we can see this all unfold. Reddit doesn't forget,http://i.imgur.com/o5sRF3L.jpg,0,7bf2ce94-6daa-4d04-8fd6-2e519606b48c
1401135823.0,i.imgur.com,26jq1a,626,24,405494ef-bd08-400b-b682-4f97cb4349e5,2510,pics,Bodyguard goes undercover as a graduating friend with Emma Watson,http://i.imgur.com/6GqjIyY.png,1,7bf2ce94-6daa-4d04-8fd6-2e519606b48c
